<xs:schema attributeFormDefault="unqualified" elementFormDefault="qualified" xmlns:xs="http://www.w3.org/2001/XMLSchema">
  <xs:element name="enrollees">
    <xs:complexType>
      <xs:sequence>
        <xs:element name="enrollee" maxOccurs="unbounded" minOccurs="0">
          <xs:complexType>
            <xs:sequence>
              <xs:element type="xs:string" name="firstName"/>
              <xs:element type="xs:string" name="middleName"/>
              <xs:element type="xs:string" name="lastName"/>
              <xs:element type="xs:string" name="facultyName"/>
              <xs:element type="xs:integer" name="id"/>
            </xs:sequence>
          </xs:complexType>
        </xs:element>
      </xs:sequence>
    </xs:complexType>
  </xs:element>
</xs:schema>
