<?xml version="1.0" encoding="UTF-8"?>
<enrollees xmlns:xs="http://www.w3.org/2001/XMLSchema-instance" 
	xs:noNamespaceSchemaLocation="enrollees.xsd">
	<enrollee>
		<firstName>g</firstName>
		<middleName>g</middleName>
		<lastName>g</lastName>
		<facultyName>ITP</facultyName>
		<id>132070</id>
	</enrollee>
	
	<enrollee>
		<firstName>t</firstName>
		<middleName>t</middleName>
		<lastName>t</lastName>
		<facultyName>POIT</facultyName>
		<id>144979</id>
	</enrollee>

	<enrollee>
		<firstName>t</firstName>
		<middleName>t</middleName>
		<lastName>t</lastName>
		<facultyName>ITP</facultyName>
		<id>144979</id>
	</enrollee>
		
</enrollees>